URL,Title,Author,Number of reviews,Number of ratings,Average rating,Pages,Publish year,Series,Genres,Awards,Places
https://www.goodreads.com//book/show/12067.Good_Omens,"Good Omens: The Nice and Accurate Prophecies of Agnes Nutter, Witch",Terry Pratchett,28190,561126,4.24,491,2006,FALSE,"Fantasy, Fiction, Humor","Locus Award Nominee for Best Fantasy Novel (1991), World Fantasy Award Nominee for Best Novel (1991)","London, England, Lower Tadfield, England"
https://www.goodreads.com//book/show/7157310-rot-ruin,Rot & Ruin,Jonathan Maberry,3743,32671,4.1,458,2010,TRUE,"Horror, Zombies, Young Adult","Bram Stoker Award Nominee for Best Novel (2010), Lincoln Award Nominee (2016), CYBILS Award for Young Adult Fantasy & Science Fiction (2010), Missouri Gateway Readers Award (2013)",California
https://www.goodreads.com//book/show/6219656-the-lottery,The Lottery,Shirley Jackson,3177,59951,4.09,30,1990,FALSE,"Short Stories, Classics, Horror",,Vermont
https://www.goodreads.com//book/show/14185.The_Three_Stigmata_of_Palmer_Eldritch,The Three Stigmata of Palmer Eldritch,Philip K. Dick,1613,32053,4.01,231,2010,FALSE,"Science Fiction, Fiction, Science Fiction Fantasy",Nebula Award Nominee for Best Novel (1965),
https://www.goodreads.com//book/show/954674.Little_Brother,Little Brother,Cory Doctorow,5627,47652,3.93,382,2008,TRUE,"Young Adult, Science Fiction, Fiction","Hugo Award Nominee for Best Novel (2009), Nebula Award Nominee for Best Novel (2008), Locus Award Nominee for Best Young Adult Book (2009), Kurd-Laßwitz-Preis Nominee for Bestes ausländisches Werk (Best Foreign Work) (2011), Golden Duck Award for Young Adult (Hal Clement Award) (2009), Sunburst Award for Young Adult Work (2009), John W. Campbell Memorial Award (2009), Emperor Norton Award (2008), Grand Prix de l'Imaginaire Nominee for Roman jeunesse étranger (2013), Prometheus Award for Best Novel (2009), Sakura Medal Nominee for High School Book (2010), Florida Teens Read Nominee (2009), Lincoln Award Nominee (2013), White Pine Award (2009), Premio El Templo de las Mil Puertas Nominee for Mejor novela extranjera independiente (2011), Seiun Award 星雲賞 Nominee for Best Translated Long Form (2012)","San Francisco, California"
https://www.goodreads.com//book/show/44767458-dune,Dune,Frank Herbert,25712,806220,4.23,661,2019,TRUE,"Science Fiction, Fiction, Fantasy","Hugo Award for Best Novel (1966), Nebula Award for Best Novel (1965), Seiun Award 星雲賞 for Best Foreign Novel (1974)","Arrakis, Caladan, Giedi Prime, Harko, Arrakin, Sietch Tabr"
https://www.goodreads.com//book/show/38619.Magic_Bites,Magic Bites,Ilona Andrews,7023,108603,4.05,261,2007,TRUE,"Fantasy, Urban Fantasy, Fantasy",DABWAHA Romance Tournament for Best Novel with Romantic Elements/Crossover (2008),"Atlanta, Georgia"
https://www.goodreads.com//book/show/116445.Dies_the_Fire,Dies the Fire,S.M. Stirling,1473,15199,3.93,573,2005,TRUE,"Science Fiction, Fantasy, Apocalyptic",,Oregon
https://www.goodreads.com//book/show/5479.Brave_New_World_Brave_New_World_Revisited,Brave New World / Brave New World Revisited,Aldous Huxley,1471,143201,4.17,340,2005,FALSE,"Classics, Fiction, Science Fiction",,
https://www.goodreads.com//book/show/54775299-the-present,The Present,Kenneth   Thomas,103,3894,4.25,200,2020,TRUE,"Science Fiction, Science Fiction, Dystopia",,
https://www.goodreads.com//book/show/287861.Mortal_Engines,Mortal Engines,Philip Reeve,5262,51482,3.77,326,2004,TRUE,"Fantasy, Young Adult, Science Fiction","Whitbread Award Nominee for Children's Book (0), Rhode Island Teen Book Award Nominee (2006), Nestlé Smarties Book Prize for 9-11 years (2002), Lincoln Award Nominee (2006), North East Teenage Book Award Nominee (2003), Seiun Award 星雲賞 for Best Translated Long Form (2007)",
https://www.goodreads.com//book/show/8665876-awaken,Awaken,Katie Kacvinsky,1554,14487,3.89,309,2011,TRUE,"Young Adult, Science Fiction, Dystopia",,"Corvallis, Oregon"
https://www.goodreads.com//book/show/11045709-when-she-woke,When She Woke,Hillary Jordan,4390,26196,3.67,344,2011,FALSE,"Fiction, Science Fiction, Dystopia","Lambda Literary Award Nominee for Lesbian General Fiction (2012), Andrew Carnegie Medal Nominee for Fiction (2012), Goodreads Choice Award Nominee for Science Fiction (2011)",
https://www.goodreads.com//book/show/9680114-pure,Pure,Julianna Baggott,3171,23398,3.74,431,2012,TRUE,"Young Adult, Science Fiction, Dystopia",ALA Alex Award (2013),
https://www.goodreads.com//book/show/9593.Gal_pagos,Galápagos,Kurt Vonnegut Jr.,2892,70657,3.86,324,1999,FALSE,"Fiction, Science Fiction, Classics",John W. Campbell Memorial Award Nominee for Best Science Fiction Novel (1986),"Ecuador, Galapagos"
https://www.goodreads.com//book/show/69477.Z_for_Zachariah,Z for Zachariah,Robert C. O'Brien,1643,14064,3.67,249,1976,FALSE,"Young Adult, Science Fiction, Fiction","Jane Addams Children's Book Award Nominee (1976), Edgar Award for Best Juvenile (1976)",United States of America
https://www.goodreads.com//book/show/9297774-eve,Eve,Anna Carey,3500,41718,3.69,336,2011,TRUE,"Science Fiction, Dystopia, Young Adult",,"Lake Tahoe, Sedona, Arizona, San Francisco Bay Area, California"
https://www.goodreads.com//book/show/333867.The_Stars_My_Destination,The Stars My Destination,Alfred Bester,2810,43485,4.1,258,1996,FALSE,"Science Fiction, Fiction, Classics",Prometheus Hall of Fame Award (1988),
https://www.goodreads.com//book/show/9975679-ashes,Ashes,Ilsa J. Bick,2956,24351,3.93,465,2011,TRUE,"Young Adult, Horror, Zombies","Audie Award Nominee for Solo Narration -- Female (2012), Milwaukee County Teen Book Award Nominee (2013), Lincoln Award Nominee (2014), Missouri Gateway Readers Award Nominee (2014)",
https://www.goodreads.com//book/show/24983.Doomsday_Book,Doomsday Book,Connie Willis,5418,50663,4.02,578,1992,TRUE,"Science Fiction, Science Fiction, Time Travel","Hugo Award for Best Novel (1993), Nebula Award for Best Novel (1992), Locus Award for Best Science Fiction Novel (1993), Arthur C. Clarke Award Nominee (1993), Mythopoeic Fantasy Award Nominee for Adult Literature (1993), Kurd-Laßwitz-Preis for Foreign Novel (1994)",United Kingdom
https://www.goodreads.com//book/show/6065215-the-strain,The Strain,Guillermo del Toro,6572,79350,3.78,403,2009,TRUE,"Horror, Fiction, Paranormal","Prix Masterton for Roman traduit (2010), Goodreads Choice Award Nominee for Fantasy (2009), Lord Ruthven Award for Fiction (2010)","Manhattan, New York City, New York"
https://www.goodreads.com//book/show/776573.Riddley_Walker,Riddley Walker,Russell Hoban,819,7073,4.02,256,1998,FALSE,"Fiction, Science Fiction, Apocalyptic","Nebula Award Nominee for Best Novel (1982), John W. Campbell Memorial Award for Best Science Fiction Novel (1982), National Book Critics Circle Award Nominee for Fiction (1981)","Canterbury, Kent, England"
https://www.goodreads.com//book/show/18131.A_Wrinkle_in_Time,A Wrinkle in Time,Madeleine L'Engle,34273,1068049,3.99,211,1973,TRUE,"Fantasy, Fiction, Classics","Newbery Medal (1963), Dorothy Canfield Fisher Children's Book Award Nominee (1964), Oklahoma Sequoyah Award (1965), Margaret A. Edwards Award (1998)",
https://www.goodreads.com//book/show/1137215.Boneshaker,Boneshaker,Cherie Priest,4095,31896,3.52,416,2009,TRUE,"Science Fiction, Steampunk, Fantasy","Hugo Award Nominee for Best Novel (2010), Nebula Award Nominee for Best Novel (2009), Locus Award for Best Science Fiction Novel (2010)","Seattle, Washington"
https://www.goodreads.com//book/show/60926.Lilith_s_Brood,Lilith's Brood,Octavia E. Butler,1137,15024,4.35,746,2000,TRUE,"Science Fiction, Fiction, Fantasy",,
https://www.goodreads.com//book/show/7437.Naked_Lunch,Naked Lunch,William S. Burroughs,3588,85695,3.46,289,2004,FALSE,"Fiction, Classics, Literature",,
https://www.goodreads.com//book/show/47626.Shade_s_Children,Shade's Children,Garth Nix,586,11986,3.9,345,1998,TRUE,"Young Adult, Science Fiction, Fantasy",Golden Duck Award Nominee for Young Adult (Hal Clement Award) (1998),
https://www.goodreads.com//book/show/430214.Vurt,Vurt,Jeff Noon,560,8676,4.06,342,1996,TRUE,"Science Fiction, Fiction, Science Fiction",Arthur C. Clarke Award (1994),
https://www.goodreads.com//book/show/7747374-i-am-number-four,I Am Number Four,Pittacus Lore,15895,317931,3.94,440,2010,TRUE,"Young Adult, Fantasy, Science Fiction","West Australian Young Readers' Book Award (WAYRBA) for Older Readers (2012), Ulmer Unke (2011)","Paradise, Ohio"
https://www.goodreads.com//book/show/550165.Ecotopia,Ecotopia,Ernest Callenbach,513,4195,3.6,181,1990,FALSE,"Fiction, Science Fiction, Environment",,United States of America
https://www.goodreads.com//book/show/10215349-the-immortal-rules,The Immortal Rules,Julie Kagawa,6148,67643,4.07,485,2012,TRUE,"Paranormal, Vampires, Young Adult",Goodreads Choice Award Nominee for Young Adult Fantasy & Science Fiction (2012),
https://www.goodreads.com//book/show/138398.The_Walking_Dead_Vol_1,"The Walking Dead, Vol. 1: Days Gone Bye",Robert Kirkman,4177,206654,4.27,144,2013,TRUE,"Sequential Art, Graphic Novels, Sequential Art",,"Atlanta, Georgia, Cynthiana, Kentucky"
https://www.goodreads.com//book/show/1722717.The_Declaration,The Declaration,Gemma Malley,1669,21151,3.71,320,2007,TRUE,"Young Adult, Science Fiction, Dystopia",Carnegie Medal Nominee (2009),"Bloomsbury, England"
https://www.goodreads.com//book/show/473850.Make_Room_Make_Room_,Make Room! Make Room!,Harry Harrison,582,6733,3.72,288,1994,FALSE,"Science Fiction, Fiction, Science Fiction",,"New York City, New York"
https://www.goodreads.com//book/show/941731.The_Death_of_Grass,The Death of Grass,John Christopher,664,7650,3.87,222,1982,FALSE,"Science Fiction, Fiction, Apocalyptic",,Great Britain
https://www.goodreads.com//book/show/13326831-the-testing,The Testing,Joelle Charbonneau,6866,61697,4.04,325,2013,TRUE,"Science Fiction, Dystopia, Young Adult","Anthony Award for Best Children's or Young Adult Novel (2014), Agatha Award Nominee for Best Children's/Young Adult Novel (2013), Lincoln Award Nominee (2015), Missouri Truman Readers Award Nominee (2016)","Tosu City, United Commonwealth"
https://www.goodreads.com//book/show/15982689-brookhaven,"Brookhaven (Web of Fate, #1)",J.C. Eggleton,3,25,4.12,264,2012,FALSE,"Science Fiction, Dystopia",,
https://www.goodreads.com//book/show/15549.Armageddon_s_Children,Armageddon's Children,Terry Brooks,748,15451,4.11,371,2006,TRUE,"Fantasy, Fiction, Science Fiction Fantasy",,
https://www.goodreads.com//book/show/19161852-the-fifth-season,The Fifth Season,N.K. Jemisin,18026,160345,4.28,468,2015,TRUE,"Fantasy, Fiction, Science Fiction","Hugo Award for Best Novel (2016), Nebula Award Nominee for Best Novel (2015), Locus Award Nominee for Best Fantasy Novel (2016), World Fantasy Award Nominee for Best Novel (2016), Grand Prix de l'Imaginaire Nominee for Traduction (2018) (2019), James Tiptree Jr. Award Nominee for Longlist (2015), Premio Ignotus Nominee for Mejor novela extranjera - Best Foreign Novel (2018), The Kitschies Nominee for Red Tentacle (Novel) (2015), Goodreads Choice Award Nominee for Fantasy (2015), Dragon Award Nominee for Best Fantasy Novel and Best Apocalyptic Novel (2016), Le Blanc Award Nominee for Melhor Romance Estrangeiro de Fantasia, Ficção Científica ou Terror Publicado em Língua Portuguesa (2018)",
https://www.goodreads.com//book/show/14497.Neverwhere,Neverwhere,Neil Gaiman,23060,439632,4.16,370,2003,TRUE,"Fantasy, Fiction, Fantasy","Mythopoeic Fantasy Award Nominee for Adult Literature (1998), Prix Julia Verlanger (1999)","London, England, England, United Kingdom"
https://www.goodreads.com//book/show/16634.The_Glass_Bead_Game,The Glass Bead Game,Hermann Hesse,1553,32288,4.12,578,2002,FALSE,"Fiction, Classics, Philosophy","Премія імені Максима Рильського (1992), Retro Hugo Award Nominee for Best Novel (2019)",
https://www.goodreads.com//book/show/2845024-anathem,Anathem,Neal Stephenson,4938,64062,4.16,937,2008,FALSE,"Science Fiction, Fiction, Fantasy","Hugo Award Nominee for Best Novel (2009), Locus Award for Best Science Fiction Novel (2009), Arthur C. Clarke Award Nominee (2009), British Science Fiction Association Award Nominee for Best Novel (2008), Endeavour Award Nominee (2009)",
https://www.goodreads.com//book/show/2791536-skinned,Skinned,Robin Wasserman,1027,12768,3.54,368,2008,TRUE,"Young Adult, Science Fiction, Science Fiction",,
https://www.goodreads.com//book/show/27774758-an-ember-in-the-ashes,An Ember in the Ashes,Sabaa Tahir,23981,193655,4.27,446,2016,TRUE,"Fantasy, Young Adult, Romance","Pennsylvania Young Readers' Choice Award Nominee for Young Adults (2017), Rhode Island Teen Book Award Nominee (2017), Evergreen Teen Book Award Nominee (2018), Milwaukee County Teen Book Award Nominee (2016), Dioraphte Jongerenliteratuurprijs Nominee for Vertaald boek (2016), Lincoln Award Nominee (2018), David Gemmell Morningstar Award Nominee for Best Fantasy Newcomer (2016), Goodreads Choice Award Nominee for Debut Goodreads Author, and for Young Adult Fantasy & Science Fiction (2015), The Magnolia Award Nominee for 9-12 (2018), Prix Elbakin.net for Meilleur roman fantasy traduit Jeunesse (2016), Missouri Gateway Readers Award Nominee (2017), Premio El Templo de las Mil Puertas Nominee for Mejor novela extranjera perteneciente a saga (2015)",
https://www.goodreads.com//book/show/85867.Dhalgren,Dhalgren,Samuel R. Delany,1028,9662,3.79,801,2001,FALSE,"Science Fiction, Fiction, Fantasy","Nebula Award Nominee for Novel (1975), Locus Award Nominee for Best Novel (1976)",
https://www.goodreads.com//book/show/6171892-genesis,Genesis,Bernard Beckett,1813,11359,3.88,150,2009,FALSE,"Science Fiction, Science Fiction, Dystopia","The Inky Awards Nominee for Silver Inky (2008), Goodreads Choice Award Nominee for Science Fiction (2009), The Inky Awards Shortlist for Silver Inky (2008), Seiun Award 星雲賞 for Best Translated Long Form (2011)",
https://www.goodreads.com//book/show/16077824-dream-caster,Dream Caster,Najeev Raj Nadarajah,81,194,4.13,362,2012,TRUE,"Fantasy, Young Adult, Science Fiction",,The Shield
https://www.goodreads.com//book/show/30072.The_Brief_History_of_the_Dead,The Brief History of the Dead,Kevin Brockmeier,1829,11088,3.67,252,2007,FALSE,"Fiction, Fantasy, Science Fiction","Locus Award Nominee for Best Fantasy Novel (2007), New York Public Library Young Lions Fiction Award Nominee (2007), Borders Original Voices Award for Fiction (2006), Booker Worthen Literary Prize (2007)",Antarctica
https://www.goodreads.com//book/show/5472.Animal_Farm_1984,Animal Farm / 1984,George Orwell,2085,167409,4.29,400,2003,FALSE,"Classics, Fiction, Science Fiction",,
https://www.goodreads.com//book/show/668.We_the_Living,We the Living,Ayn Rand,1380,26323,3.92,464,1996,FALSE,"Fiction, Classics, Philosophy",,"St. Petersburg, Russia, Russia"
https://www.goodreads.com//book/show/4985.Welcome_to_the_Monkey_House,Welcome to the Monkey House,Kurt Vonnegut Jr.,1964,56307,4.11,331,2013,FALSE,"Fiction, Short Stories, Science Fiction",,
https://www.goodreads.com//book/show/18498558-bird-box,Bird Box,Josh Malerman,16845,148778,4.02,262,2014,TRUE,"Horror, Fiction, Thriller","Bram Stoker Award Nominee for Best First Novel (2014), Shirley Jackson Award Nominee for Novel (2014), Goodreads Choice Award Nominee for Horror (2014), James Herbert Award Nominee (2015), This is Horror Award for Novel (2014)","George's house, Jane Tucker School for the Blind"
https://www.goodreads.com//book/show/1689657.World_Made_by_Hand,World Made by Hand,James Howard Kunstler,994,6521,3.67,317,2008,TRUE,"Fiction, Apocalyptic, Post Apocalyptic",,
https://www.goodreads.com//book/show/59960.Batman,Batman: The Dark Knight Returns,Frank Miller,3524,163237,4.26,197,2012,TRUE,"Sequential Art, Comics, Sequential Art",,United States of America
https://www.goodreads.com//book/show/12331767-high-rise,High-Rise,J.G. Ballard,2390,25780,3.61,208,2012,FALSE,"Fiction, Science Fiction, Science Fiction",,"London, England"
https://www.goodreads.com//book/show/10176119-harrison-bergeron,Harrison Bergeron,Kurt Vonnegut Jr.,945,14786,4.21,9,,FALSE,"Short Stories, Fiction, Science Fiction",,
https://www.goodreads.com//book/show/9579634-prince-of-thorns,Prince of Thorns,Mark  Lawrence,6800,98042,3.85,373,2011,TRUE,"Fantasy, Fiction, Fantasy","Grand Prix de l'Imaginaire Nominee (2013), David Gemmell Morningstar Award Nominee for Best Fantasy Newcomer (2012), Goodreads Choice Award Nominee for Fantasy (2011)",
https://www.goodreads.com//book/show/59924.The_Lathe_of_Heaven,The Lathe of Heaven,Ursula K. Le Guin,3901,53351,4.11,176,2003,FALSE,"Science Fiction, Fiction, Fantasy","Hugo Award Nominee for Best Novel (1972), Nebula Award Nominee for Best Novel (1971), Locus Award for Best Novel (1972), Ditmar Award Nominee for Best International Long Fiction (1972)","Portland, Oregon"
https://www.goodreads.com//book/show/387339.Beauty,Beauty,Sheri S. Tepper,392,5452,3.83,463,2009,FALSE,"Fantasy, Science Fiction, Fiction",Locus Award for Best Fantasy Novel (1992),
https://www.goodreads.com//book/show/373009.Biting_the_Sun,Biting the Sun,Tanith Lee,171,1901,4.23,384,1999,TRUE,"Fantasy, Science Fiction, Fiction",,
https://www.goodreads.com//book/show/6933141-xvi,XVI,Julia Karr,992,7646,3.45,325,2011,TRUE,"Young Adult, Science Fiction, Dystopia",,"Chicago, Illinois"
https://www.goodreads.com//book/show/13089710-the-kill-order,The Kill Order,James Dashner,9810,167545,3.71,327,2012,TRUE,"Young Adult, Science Fiction, Dystopia",,"North Carolina, New York City, New York"
https://www.goodreads.com//book/show/8951449-hollowland,Hollowland,Amanda Hocking,1595,17907,3.96,312,2010,TRUE,"Horror, Zombies, Young Adult",,
https://www.goodreads.com//book/show/161846.The_Midwich_Cuckoos,The Midwich Cuckoos,John Wyndham,1070,18373,3.93,220,1958,FALSE,"Science Fiction, Fiction, Horror",,
https://www.goodreads.com//book/show/5730888-the-unit,The Unit,Ninni Holmqvist,1258,8414,3.73,268,2009,FALSE,"Fiction, Science Fiction, Dystopia",,
https://www.goodreads.com//book/show/17701160-aberrant,Aberrant,Ruth  Silver,227,1450,3.74,240,2013,TRUE,"Science Fiction, Dystopia, Young Adult",,
https://www.goodreads.com//book/show/924194.The_Last_Book_in_the_Universe,The Last Book in the Universe,Rodman Philbrick,1063,8851,3.91,223,2000,FALSE,"Young Adult, Science Fiction, Science Fiction","Rhode Island Teen Book Award Nominee (2002), Dorothy Canfield Fisher Children's Book Award Nominee (2002)",
https://www.goodreads.com//book/show/68428.The_Final_Empire,The Final Empire,Brandon Sanderson,29008,419285,4.44,544,2006,TRUE,"Fantasy, Fiction, Fantasy","Tähtifantasia Award Nominee (2018), Prix Elbakin.net for Meilleur roman fantasy traduit (2010)",Luthadel
https://www.goodreads.com//book/show/17182126-steelheart,Steelheart,Brandon Sanderson,13482,155380,4.13,386,2013,TRUE,"Fantasy, Young Adult, Science Fiction","Georgia Peach Book Award Nominee for Honor book (2014), South Carolina Book Award Nominee for Young Adult (2016), Rhode Island Teen Book Award (2015), Lincoln Award Nominee (2016), Goodreads Choice Award Nominee for Best Young Adult Fantasy & Science Fiction (2013), Green Mountain Book Award Nominee (2016), Missouri Gateway Readers Award Nominee (2016)",
https://www.goodreads.com//book/show/8051458-the-reapers-are-the-angels,The Reapers are the Angels,Alden Bell,1614,11144,3.89,225,2010,TRUE,"Horror, Zombies, Horror","Philip K. Dick Award Nominee (2011), Shirley Jackson Award Nominee for Novel (Finalist) (2010), ALA Alex Award (2011)",South
https://www.goodreads.com//book/show/331256.Roadside_Picnic,Roadside Picnic,Arkady Strugatsky,2928,44104,4.18,145,2000,FALSE,"Science Fiction, Fiction, Cultural","John W. Campbell Memorial Award Nominee for Best Science Fiction Novel (1978), Graoully d'Or for Roman étranger (1981), Science Fiction and Fantasy Translation Award Nominee for Long Form (Honorable Mention) (2013)",
https://www.goodreads.com//book/show/49491650-death,Death,Laura Thalassa,36,56,4.5,not known,not known,TRUE,"Romance, Fantasy, Fantasy",,
https://www.goodreads.com//book/show/8809.The_Wanting_Seed,The Wanting Seed,Anthony Burgess,347,5972,3.7,288,1996,FALSE,"Fiction, Science Fiction, Science Fiction",,United Kingdom
https://www.goodreads.com//book/show/59219.The_Talisman,The Talisman,Stephen King,3490,109033,4.13,656,2001,TRUE,"Horror, Fantasy, Fiction","Locus Award Nominee for Best Fantasy Novel (1985), World Fantasy Award Nominee for Best Novel (1985), Audie Award for Fiction, Unabridged (2002)",
https://www.goodreads.com//book/show/415459.I_Have_No_Mouth_and_I_Must_Scream,I Have No Mouth and I Must Scream,Harlan Ellison,1221,18976,3.97,134,1984,FALSE,"Science Fiction, Horror, Short Stories",Hugo Award for Best Short Story (1968),
https://www.goodreads.com//book/show/16718.Gun_With_Occasional_Music,"Gun, With Occasional Music",Jonathan Lethem,1005,9824,3.77,271,2003,FALSE,"Fiction, Science Fiction, Mystery","Nebula Award Nominee for Best Novel (1994), Locus Award for Best First Novel (1995), IAFA William L. Crawford Fantasy Award (1995), SF Chronicle Award Nominee for Best Novel (1995), Tähtivaeltaja Award (2002)","Oakland, California"
https://www.goodreads.com//book/show/8935689-consider-phlebas,Consider Phlebas,Iain M. Banks,3963,75888,3.86,471,1988,TRUE,"Science Fiction, Fiction, Space",,
https://www.goodreads.com//book/show/10677277-article-5,Article 5,Kristen Simmons,2759,27458,3.77,362,2012,TRUE,"Science Fiction, Dystopia, Young Adult",Missouri Gateway Readers Award Nominee (2015),Kentucky
https://www.goodreads.com//book/show/15811102-cryonic,Cryonic,Travis Bradberry,124,637,3.18,261,2013,FALSE,"Horror, Zombies, Horror",,
https://www.goodreads.com//book/show/30628688-crescent-moon,Crescent Moon,James Fahy,110,304,4.6,not known,2016,TRUE,"Fantasy, Fantasy, Urban Fantasy",,
https://www.goodreads.com//book/show/256683.City_of_Bones,City of Bones,Cassandra Clare,62670,1655374,4.1,485,2007,TRUE,"Fantasy, Young Adult, Fantasy","Locus Award Nominee for Best First Novel (2008), Georgia Peach Book Award Nominee for Honor book (2009), South Carolina Book Award Nominee for Young Adult Book Award (2010), Pacific Northwest Library Association Young Reader's Choice Award (2010), Lincoln Award (2010)","New York City, New York"
https://www.goodreads.com//book/show/304752.The_Sirens_of_Titan,The Sirens of Titan,Kurt Vonnegut Jr.,4843,118165,4.14,326,1998,FALSE,"Science Fiction, Fiction, Classics","Hugo Award Nominee for Best Novel (1960), Seiun Award 星雲賞 for Best Foreign Novel (1973)","Indianapolis, Indiana, Newport, Rhode Island"
https://www.goodreads.com//book/show/816440.War_with_the_Newts,War with the Newts,Karel Čapek,859,9968,4.17,241,1990,FALSE,"Science Fiction, Fiction, Classics",,
https://www.goodreads.com//book/show/18484780-the-beast-of-cretacea,The Beast of Cretacea,Todd Strasser,88,373,4.04,not known,2015,FALSE,"Science Fiction, Young Adult, Adventure",,
https://www.goodreads.com//book/show/18302455-the-circle,The Circle,Dave Eggers,23336,185999,3.43,493,2013,FALSE,"Fiction, Science Fiction, Science Fiction","John W. Campbell Memorial Award Nominee (2014), Deutscher Jugendliteraturpreis Nominee for Preis der Jugendjury (2015), Dioraphte Jongerenliteratuurprijs Nominee (2014), Mary Shelley Award for Outstanding Fictional Work (2015), Andrew Carnegie Medal Nominee for Fiction (2014)","California, United States of America"
https://www.goodreads.com//book/show/161426.How_I_Live_Now,How I Live Now,Meg Rosoff,4745,41104,3.58,194,2004,FALSE,"Young Adult, Fiction, Science Fiction","Orange Prize Nominee for New Writers (2005), Guardian Children's Fiction Prize (2004), Michael L. Printz Award (2005), Deutscher Jugendliteraturpreis Nominee for Jugendbuch (2006), Branford Boase Award (2005), Boston Author's Club Young Reader Award (2005), North East Teenage Book Award Nominee (2005), Bronzener Lufti (2006)",United Kingdom
https://www.goodreads.com//book/show/10357575-1q84,1Q84,Haruki Murakami,18273,208507,3.92,925,2011,TRUE,"Fiction, Fantasy, Magical Realism","Andrew Carnegie Medal Nominee for Fiction (2012), Premi Ictineu for Millor novel·la traduïda (2012), Goodreads Choice Award for Fiction (2011), International Dublin Literary Award Nominee for Shortlist (2013)",Tokyo
https://www.goodreads.com//book/show/17934530-annihilation,Annihilation,Jeff VanderMeer,17978,158538,3.71,195,2014,TRUE,"Science Fiction, Fiction, Horror","Nebula Award for Best Novel (2014), Locus Award Nominee for Best Science Fiction Novel (2015), Warwick Prize for Writing Nominee for Longlist (2015), Shirley Jackson Award for Novel (2014), Tähtivaeltaja Award Nominee (2016), Goodreads Choice Award Nominee for Science Fiction (2014)",
https://www.goodreads.com//book/show/29579.Foundation,Foundation,Isaac Asimov,10090,420174,4.17,244,2004,TRUE,"Science Fiction, Fiction, Classics",,
https://www.goodreads.com//book/show/8517207-bumped,Bumped,Megan McCafferty,2364,12958,3.12,326,2011,TRUE,"Young Adult, Science Fiction, Dystopia",Golden Duck Award Nominee for Young Adult (Hal Clement Award) (2012),"Princeton, New Jersey"
https://www.goodreads.com//book/show/18126198-four,Four: A Divergent Story Collection,Veronica Roth,10993,166133,4.03,208,2014,TRUE,"Young Adult, Science Fiction, Dystopia",Goodreads Choice Award Nominee for Young Adult Fantasy & Science Fiction (2014),"Chicago, Illinois"
https://www.goodreads.com//book/show/22816087-seveneves,Seveneves,Neal Stephenson,10435,97797,3.98,880,2015,FALSE,"Science Fiction, Fiction, Apocalyptic","Hugo Award Nominee for Best Novel (2016), Locus Award Nominee for Best SF Novel (2016), Kurd-Laßwitz-Preis for Bestes ausländisches Werk  (2016), John W. Campbell Memorial Award Nominee for Best Science Fiction Novel (2016), Prometheus Award for Best Novel (2016), Goodreads Choice Award Nominee for Science Fiction (2015), Seiun Award 星雲賞 Nominee for Best Translated Novel (2019)",
