URL,Title,Author,Number of reviews,Number of ratings,Average rating,Pages,Publish year,Series,Genres,Awards,Places
https://www.goodreads.com//book/show/11806716-blackout,Blackout,Mira Grant,1871,20834,4.09,512,2012,TRUE,"Horror, Zombies, Horror","Hugo Award Nominee for Best Novel (2013), Goodreads Choice Award Nominee for Horror (2012)",
https://www.goodreads.com//book/show/38709.Holes,Holes,Louis Sachar,20817,991015,3.97,233,2000,TRUE,"Young Adult, Fiction, Childrens","Newbery Medal (1999), National Book Award for Young People's Literature (1998), West Australian Young Readers' Book Award (WAYRBA) for Older Readers (2001), Grand Canyon Reader Award for Teen Book (2001), Nene Award (2001), Maryland Black-Eyed Susan Book Award for Grade 6-9 (2001), Massachusetts Children's Book Award (2001), Flicker Tale Children's Book Award (2000), Pennsylvania Young Readers' Choice Award for Grades 6-8 (2000), Dorothy Canfield Fisher Children's Book Award (2000), Evergreen Teen Book Award (2001), Soaring Eagle Book Award (2003), Sunshine State Young Readers Award for Grades 3-5 and Grades 6-8 (2002), Pacific Northwest Library Association Young Reader's Choice Award for Junior (2001), Zilveren Zoen (2000), Deutscher Jugendliteraturpreis Nominee for Jugendbuch (2001), Boston Globe-Horn Book Award for Fiction (1999), New Mexico Land of Enchantment Award for Young Adult (2001), William Allen White Children's Book Award (2001), Oklahoma Sequoyah Award for Children and YA (2001), Rebecca Caudill Young Readers' Book Award (2002), Premi Protagonista Jove for Categoria 14-15 anys (2000)","Green Lake, Texas"
https://www.goodreads.com//book/show/49480530-famine,Famine,Laura Thalassa,1149,7319,4.31,404,2020,TRUE,"Romance, Fantasy, Fantasy",,
https://www.goodreads.com//book/show/618174.Moonheart,Moonheart,Charles de Lint,373,6089,4.05,447,1994,TRUE,"Fantasy, Fantasy, Urban Fantasy","Mythopoeic Fantasy Award Nominee (1985), IAFA William L. Crawford Fantasy Award (1985)",
https://www.goodreads.com//book/show/11544466-breathe,Breathe,Sarah Crossan,1847,16941,3.69,373,2012,TRUE,"Science Fiction, Dystopia, Young Adult",Carnegie Medal Nominee (2014),
https://www.goodreads.com//book/show/52350.The_Stepford_Wives,The Stepford Wives,Ira Levin,2341,29660,3.78,144,2002,FALSE,"Horror, Fiction, Science Fiction",,Connecticut
https://www.goodreads.com//book/show/121606.A_Door_Into_Ocean,A Door Into Ocean,Joan Slonczewski,185,2115,3.97,403,2000,TRUE,"Science Fiction, Fiction, Feminism",John W. Campbell Memorial Award for Best Science Fiction Novel (1987),
https://www.goodreads.com//book/show/10644930-11-22-63,11/22/1963,Stephen King,38629,431826,4.3,849,2011,FALSE,"Fiction, Historical, Historical Fiction","Locus Award Nominee for Best SF Novel (2012), World Fantasy Award Nominee for Best Novel (2012), ITW Thriller Award for Best Hard Cover Novel (2012), Grand Prix de l'Imaginaire Nominee for Roman étranger (2014), British Fantasy Award Nominee for Best Novel (2012), このミステリーがすごい！ for Best Translated Mystery Novel of the Year in Japan (2014), 本屋大賞 Nominee for Translated Fiction (2014), Goodreads Choice Award for Science Fiction (2011) and Nominee for Best of the Best  (2018)","Maine, Derry, Maine, Jodie, Texas"
https://www.goodreads.com//book/show/703.The_Plot_Against_America,The Plot Against America,Philip Roth,4242,51684,3.77,391,2005,FALSE,"Fiction, Historical, Historical Fiction","Locus Award Nominee for Best SF Novel (2005), WH Smith Literary Award (2005), James Fenimore Cooper Prize (2005), National Book Critics Circle Award Nominee for Fiction (2004), Tähtivaeltaja Award Nominee (2006), Sidewise Award for Long Form (2004)","Newark, New Jersey, New Jersey"
https://www.goodreads.com//book/show/99245.Nightfall,Nightfall,Isaac Asimov,835,32272,4.05,339,2012,FALSE,"Science Fiction, Fiction, Science Fiction Fantasy",,Planet Kalgash
https://www.goodreads.com//book/show/68494.Perdido_Street_Station,Perdido Street Station,China Miéville,4875,63450,3.95,623,2003,TRUE,"Fantasy, Fiction, Science Fiction","Hugo Award Nominee for Best Novel (2002), Nebula Award Nominee for Best Novel (2002), Locus Award Nominee for Best Fantasy Novel (2001), Arthur C. Clarke Award (2001), World Fantasy Award Nominee for Best Novel (2001), Kurd-Laßwitz-Preis for Bestes ausländisches Werk (Best Foreign Work) (2003), British Science Fiction Association Award Nominee for Best Novel (2000), James Tiptree Jr. Award Nominee (2000), Premio Ignotus for Mejor novela extranjera (Best Foreign Novel) (2002), British Fantasy Award for Best Novel (2001), SF ga Yomitai for Best Translated SF of the Year in Japan (2009), Seiun Award 星雲賞 Nominee for Best Translated Long Form (2010)",Bas-Lag
https://www.goodreads.com//book/show/222093.City,City,Clifford D. Simak,883,14521,4.09,251,2008,FALSE,"Science Fiction, Fiction, Short Stories",International Fantasy Award for Fiction (1953),
https://www.goodreads.com//book/show/80939.When_the_Sleeper_Wakes,When the Sleeper Wakes,H.G. Wells,334,3925,3.42,304,2003,FALSE,"Science Fiction, Fiction, Classics",,United Kingdom
https://www.goodreads.com//book/show/28448877-the-queen-of-all-that-lives,The Queen of All that Lives,Laura Thalassa,548,7771,4.19,456,2016,TRUE,"New Adult, Romance, Science Fiction",,
https://www.goodreads.com//book/show/60211.The_Shadow_of_the_Torturer,The Shadow of the Torturer,Gene Wolfe,1369,21796,3.8,262,1984,TRUE,"Fantasy, Science Fiction, Fiction","Nebula Award Nominee for Best Novel (1980), Locus Award Nominee for Best Fantasy Novel (1981), World Fantasy Award for Best Novel (1981), British Science Fiction Association Award for Best Novel (1981), John W. Campbell Memorial Award Nominee (1981), Balrog Award Nominee for Best Novel (1981), Tähtifantasia Award Nominee (2013), Tähtivaeltaja Award (2013)",Urth
https://www.goodreads.com//book/show/567708.The_Silver_Metal_Lover,The Silver Metal Lover,Tanith Lee,343,3593,4.02,291,1999,TRUE,"Science Fiction, Fantasy, Romance",,
https://www.goodreads.com//book/show/23867347-the-queen-of-traitors,The Queen of Traitors,Laura Thalassa,609,9182,4.09,348,2016,TRUE,"New Adult, Romance, Science Fiction",,
https://www.goodreads.com//book/show/30289.The_Republic,The Republic,Plato,3691,174454,3.94,416,2003,TRUE,"Philosophy, Classics, Nonfiction",,
https://www.goodreads.com//book/show/5048174-2br02b,2BR02B,Kurt Vonnegut Jr.,1066,16152,3.95,15,2007,FALSE,"Short Stories, Science Fiction, Fiction",,
https://www.goodreads.com//book/show/11168429-the-old-man-and-the-wasteland,The Old Man and the Wasteland,Nick Cole,344,5286,3.83,125,2011,TRUE,"Apocalyptic, Post Apocalyptic, Science Fiction",,
https://www.goodreads.com//book/show/10841167-dark-inside,Dark Inside,Jeyn Roberts,1100,8723,3.92,368,2011,TRUE,"Young Adult, Science Fiction, Dystopia",White Pine Award (2013),
https://www.goodreads.com//book/show/92555.The_Pesthouse,The Pesthouse,Jim Crace,341,2427,3.51,272,2007,FALSE,"Fiction, Apocalyptic, Post Apocalyptic",,
https://www.goodreads.com//book/show/261625.The_World_Inside,The World Inside,Robert Silverberg,237,2318,3.73,233,2004,FALSE,"Science Fiction, Science Fiction, Dystopia","Hugo Award Nominee for Best Novel (1972), Locus Award Nominee for Best Novel (1972)",
https://www.goodreads.com//book/show/112750.Darkfever,Darkfever,Karen Marie Moning,10568,161364,4.07,309,2006,TRUE,"Fantasy, Fantasy, Urban Fantasy",,"Ashford, Georgia, Dublin"
https://www.goodreads.com//book/show/323172.Mockingbird,Mockingbird,Walter Tevis,578,5369,4.14,288,1999,FALSE,"Science Fiction, Fiction, Science Fiction",Locus Award Nominee for Best SF Novel (1981),New York State
https://www.goodreads.com//book/show/8337087-possession,Possession,Elana Johnson,1243,9528,3.59,416,2011,TRUE,"Science Fiction, Dystopia, Young Adult",,
https://www.goodreads.com//book/show/16101023-proxy,Proxy,Alex London,1584,10239,3.88,384,2013,TRUE,"Young Adult, LGBT, Science Fiction",Missouri Gateway Readers Award Nominee (2016),
https://www.goodreads.com//book/show/140099.Greywalker,Greywalker,Kat Richardson,1158,13197,3.46,341,2006,TRUE,"Fantasy, Urban Fantasy, Fantasy",,United States of America
https://www.goodreads.com//book/show/16150830-never-fade,Never Fade,Alexandra Bracken,6785,78865,4.24,507,2013,TRUE,"Young Adult, Science Fiction, Dystopia",,
https://www.goodreads.com//book/show/68333.Beggars_in_Spain,Beggars in Spain,Nancy Kress,661,7371,3.94,400,2004,TRUE,"Science Fiction, Fiction, Speculative Fiction","Hugo Award Nominee for Best Novel (1994), Nebula Award Nominee for Best Novel (1993), Prometheus Hall of Fame Award Nominee (1994), John W. Campbell Memorial Award Nominee for Best Science Fiction Novel (1994), SF Chronicle Award",
https://www.goodreads.com//book/show/9858517-all-these-things-i-ve-done,All These Things I've Done,Gabrielle Zevin,2046,13615,3.7,354,2011,TRUE,"Young Adult, Science Fiction, Dystopia",Missouri Gateway Readers Award Nominee (2014),"New York City, New York"
https://www.goodreads.com//book/show/3007704-the-gone-away-world,The Gone-Away World,Nick Harkaway,1721,11727,4.12,531,2008,FALSE,"Science Fiction, Fiction, Fantasy",Locus Award Nominee for Best First Novel (2009),
https://www.goodreads.com//book/show/15985373-emperor-of-thorns,Emperor of Thorns,Mark  Lawrence,2521,44695,4.25,434,2013,TRUE,"Fantasy, Fiction, Fantasy","David Gemmell Legend Award for Best Fantasy Novel (2014), David Gemmell Ravenheart Award for Best Fantasy Cover Art (2014), Goodreads Choice Award Nominee for Fantasy (2013), Reddit r/fantasy Stabby Award for Best Novel (2013)",
https://www.goodreads.com//book/show/276767.The_Word_for_World_is_Forest,The Word for World is Forest,Ursula K. Le Guin,1537,18206,3.98,160,1989,TRUE,"Science Fiction, Fiction, Fantasy","Hugo Award for Best Novella (1973), Nebula Award Nominee for Best Novella (1972), Locus Award Nominee for Best Novella (1973)",
https://www.goodreads.com//book/show/1705697.Wastelands,Wastelands: Stories of the Apocalypse,John Joseph Adams,795,9237,3.77,333,2008,TRUE,"Short Stories, Science Fiction, Apocalyptic",Locus Award Nominee for Best Anthology (2009),
https://www.goodreads.com//book/show/23874411-first-contact,First Contact,Brent LeVasseur,109,161,3.99,94,2015,TRUE,"Fantasy, Science Fiction, Childrens",,
https://www.goodreads.com//book/show/25016714-society-for-supper,Society for Supper,TyCobbsTeeth,19,48,4.67,308,2015,FALSE,"Science Fiction, Horror, Fiction",,
https://www.goodreads.com//book/show/10044191-the-endlands,The Endlands,Vincent Hobbes,39,126,3.96,320,2011,TRUE,"Horror, Short Stories, Anthologies",,
https://www.goodreads.com//book/show/25220487-population,Population,Elizabeth  Stephens,115,492,4.18,251,2015,TRUE,"Science Fiction, Dystopia, Science Fiction",,
https://www.goodreads.com//book/show/7307551-moore-s-mythopoeia,Moore's Mythopoeia,Christopher WunderLee,8,19,4.37,366,2010,FALSE,"ERROR HERE!!!!!!!!!!, ERROR HERE!!!!!!!!!!, ERROR HERE!!!!!!!!!!",,
https://www.goodreads.com//book/show/14290364-champion,Champion,Marie Lu,15527,171882,4.34,369,2013,TRUE,"Science Fiction, Dystopia, Young Adult",,
https://www.goodreads.com//book/show/3039305-the-resistance,The Resistance,Gemma Malley,422,6948,3.75,323,2008,TRUE,"Young Adult, Science Fiction, Dystopia",,
https://www.goodreads.com//book/show/46182.In_Watermelon_Sugar,In Watermelon Sugar,Richard Brautigan,1085,13656,3.98,144,2002,FALSE,"Fiction, Poetry, Fantasy",,"Bolinas, California"
https://www.goodreads.com//book/show/6065629-candor,Candor,Pam Bachorz,882,6009,3.62,272,2009,FALSE,"Young Adult, Science Fiction, Dystopia","Florida Teens Read Nominee (2010), CYBILS Award Nominee for Young Adult Fantasy & Science Fiction (2009)",
https://www.goodreads.com//book/show/47953.The_Black_Jewels_Trilogy,"The Black Jewels Trilogy: Daughter of the Blood, Heir to the Shadows, Queen of the Darkness",Anne Bishop,627,12906,4.38,1204,2003,TRUE,"Fantasy, Romance, Fiction",,
https://www.goodreads.com//book/show/11371.It_Can_t_Happen_Here,It Can't Happen Here,Sinclair Lewis,2568,15305,3.77,400,2005,FALSE,"Fiction, Classics, Politics",Prometheus Hall of Fame Award (2007),"United States of America, Washington, D.C., Vermont"
https://www.goodreads.com//book/show/40611197-famous-men-who-never-lived,Famous Men Who Never Lived,K. Chess,229,1285,3.62,318,2019,FALSE,"Science Fiction, Fiction, Science Fiction",,
https://www.goodreads.com//book/show/22326.Virtual_Light,Virtual Light,William Gibson,563,22884,3.86,304,1996,TRUE,"Science Fiction, Science Fiction, Cyberpunk","Hugo Award Nominee for Best Novel (1994), Locus Award Nominee for Best Science Fiction Novel (1994), Prix Aurora Award for Best Long Form Work in English (1995)",
https://www.goodreads.com//book/show/21805717-only-ever-yours,Only Ever Yours,Louise O'Neill,2227,13313,3.77,400,2014,FALSE,"Young Adult, Science Fiction, Dystopia","Sunday Independent Newcomer of the Year (2014), YA Book Prize (2015)",
https://www.goodreads.com//book/show/20821111-the-young-elites,The Young Elites,Marie Lu,13081,113791,3.88,355,2014,TRUE,"Fantasy, Young Adult, Science Fiction","Pennsylvania Young Readers' Choice Award Nominee for Young Adults (2016), Goodreads Choice Award Nominee for Young Adult Fantasy & Science Fiction (2014)",Kenettra
https://www.goodreads.com//book/show/359375.Night_Watch,Night Watch,Sergei Lukyanenko,2208,39928,3.98,455,2006,TRUE,"Fantasy, Fantasy, Urban Fantasy",Stalker Award for Best Translated Novel (2009),Moscow
https://www.goodreads.com//book/show/444959.2001,2001: A Space Odyssey,Arthur C. Clarke,5979,265259,4.15,226,1984,TRUE,"Science Fiction, Fiction, Classics",,Outer Space
https://www.goodreads.com//book/show/8164566-evenfall,Evenfall,Ais,543,4883,4.18,1427,2007,TRUE,"Romance, M M Romance, Science Fiction",,
https://www.goodreads.com//book/show/13931214-the-moon-dwellers,The Moon Dwellers,David Estes,710,4108,3.82,369,2012,TRUE,"Science Fiction, Dystopia, Young Adult",,
https://www.goodreads.com//book/show/8306761-for-darkness-shows-the-stars,For Darkness Shows the Stars,Diana Peterfreund,2690,18147,3.88,407,2012,TRUE,"Young Adult, Science Fiction, Dystopia",,
https://www.goodreads.com//book/show/7027735-dark-life,Dark Life,Kat Falls,1671,13904,3.9,304,2010,TRUE,"Young Adult, Science Fiction, Science Fiction","Georgia Children's Book Award Nominee (2012), South Carolina Book Award Nominee (2012), Buckeye Children's Book Award Nominee for 6-8 (2012), Golden Sower Award Nominee (2013), Beehive Book Award Nominee (2012), Dorothy Canfield Fisher Children's Book Award Nominee (2012), Sunshine State Young Readers Award Nominee for grades 6-8 (2011), Maud Hart Lovelace Book Award Nominee (2012), Missouri Truman Readers Award Nominee (2012), Ulmer Unke (2012), Rebecca Caudill Young Readers' Book Award Nominee (2013)",Benthic Territory
https://www.goodreads.com//book/show/2169506.The_Dead_and_the_Gone,The Dead and the Gone,Susan Beth Pfeffer,3358,35755,3.84,336,2008,TRUE,"Young Adult, Science Fiction, Dystopia",South Carolina Book Award Nominee for Young Adult Book Award (2011),New York State
https://www.goodreads.com//book/show/6555517-the-dead-tossed-waves,The Dead-Tossed Waves,Carrie Ryan,2707,29950,3.9,416,2010,TRUE,"Young Adult, Horror, Zombies",,
https://www.goodreads.com//book/show/41130.Pacific_Edge,Pacific Edge,Kim Stanley Robinson,116,1472,3.79,336,1995,TRUE,"Science Fiction, Fiction, Science Fiction",John W. Campbell Memorial Award for Best Science Fiction Novel (1991),
https://www.goodreads.com//book/show/12891107-king-of-thorns,King of Thorns,Mark  Lawrence,2751,56319,4.2,449,2012,TRUE,"Fantasy, Fiction, Fantasy","David Gemmell Legend Award Nominee for Best Fantasy Novel (2013), Goodreads Choice Award Nominee for Fantasy (2012)",
https://www.goodreads.com//book/show/11043618-what-s-left-of-me,What's Left of Me,Kat Zhang,2096,15308,3.78,343,2012,TRUE,"Young Adult, Science Fiction, Dystopia",,Americas
https://www.goodreads.com//book/show/1768257.Malevil,Malevil,Robert Merle,254,3753,4.25,635,1983,FALSE,"Science Fiction, Fiction, Apocalyptic",John W. Campbell Memorial Award for Best Science Fiction Novel (1974),France
https://www.goodreads.com//book/show/4699575-daemon,Daemon,Daniel Suarez,3112,42900,4.15,432,2009,TRUE,"Science Fiction, Fiction, Thriller",,
https://www.goodreads.com//book/show/4703581-the-city-the-city,The City & the City,China Miéville,5874,56846,3.9,312,2009,FALSE,"Fantasy, Fiction, Science Fiction","Hugo Award for Best Novel (2010), Nebula Award Nominee for Best Novel (2009), Locus Award for Best Fantasy Novel (2010), Arthur C. Clarke Award (2010), World Fantasy Award for Best Novel (2010), Kurd-Laßwitz-Preis for Bestes ausländisches Werk (2011), British Science Fiction Association Award for Best Novel (2009), John W. Campbell Memorial Award Nominee for Best Science Fiction Novel (2010), Grand Prix de l'Imaginaire for Roman étranger and Nomination for Traduction (2012), Premio Ignotus for Mejor novela extranjera (Best Foreign Novel) (2013), Tähtifantasia Award Nominee (2012), Tähtivaeltaja Award Nominee (2012), The Kitschies for Red Tentacle (Novel) (2009), SF ga Yomitai for Best Translated SF of the Year in Japan (2012), Goodreads Choice Award Nominee for Fantasy (2009), Prix Elbakin.net for Meilleur roman fantasy traduit (2012), Seiun Award 星雲賞 Nominee for Best Translated Long Form (2012)","Besźel, Ul Qoma"
https://www.goodreads.com//book/show/25781.The_Iron_Dragon_s_Daughter,The Iron Dragon's Daughter,Michael Swanwick,291,3506,3.69,424,2012,TRUE,"Fantasy, Fiction, Science Fiction","Arthur C. Clarke Award Nominee (1994), World Fantasy Award Nominee for Best Novel (1994)",
https://www.goodreads.com//book/show/8488830-freedom,Freedom™,Daniel Suarez,1473,25387,4.27,486,2011,TRUE,"Science Fiction, Fiction, Science Fiction",Goodreads Choice Award Nominee for Science Fiction (2010),
https://www.goodreads.com//book/show/10369932-the-eleventh-plague,The Eleventh Plague,Jeff Hirsch,1857,13210,3.51,278,2011,FALSE,"Young Adult, Science Fiction, Dystopia",,
https://www.goodreads.com//book/show/15746171-linehan-s-trip,Linehan's Trip,Bryan  Murphy,4,16,4.44,not known,2012,FALSE,"ERROR HERE!!!!!!!!!!, ERROR HERE!!!!!!!!!!, ERROR HERE!!!!!!!!!!",,
https://www.goodreads.com//book/show/25347016-e,E,Kate Wrath,170,1073,3.88,not known,2014,TRUE,"Science Fiction, Science Fiction, Dystopia",,
https://www.goodreads.com//book/show/22586406-experiment,Experiment,Cyma Rizwaan Khan,17,36,4.22,372,2014,FALSE,"Science Fiction, Science Fiction, Dystopia",,
https://www.goodreads.com//book/show/33399559-the-gaia-effect,The Gaia Effect,Claire Buss,57,80,4.1,228,2016,TRUE,"Science Fiction, Dystopia, Science Fiction",,
https://www.goodreads.com//book/show/5091.The_Dark_Tower,The Dark Tower,Stephen King,5866,151100,4.24,1050,2006,TRUE,"Fantasy, Fiction, Horror",British Fantasy Award for Best Novel (2005),
https://www.goodreads.com//book/show/18172279-apocalyptic-empire,Apocalyptic Empire: The Hatchery Compound,Chris   Blake,10,54,3.65,318,2013,FALSE,"Horror, Zombies, Apocalyptic",,
https://www.goodreads.com//book/show/60924.Seed_to_Harvest,Seed to Harvest,Octavia E. Butler,359,4958,4.35,767,2007,TRUE,"Science Fiction, Fiction, Fantasy",,
https://www.goodreads.com//book/show/13576541-day-soldiers,Day Soldiers,Brandon Hale,95,885,3.92,272,2012,TRUE,"Paranormal, Vampires, Young Adult",,
https://www.goodreads.com//book/show/50277486-pestilence,Pestilence,Laura Thalassa,4246,33403,3.99,381,2018,TRUE,"Romance, Fantasy, Fantasy",Goodreads Choice Award Nominee for Romance (2018),
https://www.goodreads.com//book/show/30121324-gunfight-at-the-old-leake-canal,Gunfight at the Old Leake Canal,G.B. Hope,9,54,4.54,268,2016,FALSE,Thriller,,
https://www.goodreads.com//book/show/22350219-the-country-of-ice-cream-star,The Country of Ice Cream Star,Sandra Newman,641,2513,3.61,592,2015,FALSE,"Fiction, Science Fiction, Science Fiction",Women's Prize for Fiction Nominee for Longlist (2015),
https://www.goodreads.com//book/show/12813630-the-coldest-girl-in-coldtown,The Coldest Girl in Coldtown,Holly Black,8329,59938,3.84,419,2013,FALSE,"Young Adult, Fantasy, Paranormal","Locus Award Nominee for Young Adult Science Fiction and Fantasy (2014), Pennsylvania Young Readers' Choice Award Nominee for Young Adults (2015), Milwaukee County Teen Book Award Nominee (2015), Andre Norton Award Nominee (2013), Green Mountain Book Award Nominee (2015)",
https://www.goodreads.com//book/show/816443.R_U_R_,R.U.R. (Rossum's Universal Robots),Karel Čapek,596,8376,3.88,112,2004,FALSE,"Science Fiction, Plays, Classics",,
https://www.goodreads.com//book/show/26891429-the-city-of-mirrors,The City of Mirrors,Justin Cronin,4970,46676,4.2,602,2016,TRUE,"Horror, Fiction, Fantasy",Goodreads Choice Award Nominee for Horror (2016),"New York City, New York, Kerrville, Texas, Houston, Texas"
https://www.goodreads.com//book/show/24768.Pretties,Pretties,Scott Westerfeld,10368,235549,3.85,370,2005,TRUE,"Young Adult, Science Fiction, Dystopia",,
https://www.goodreads.com//book/show/3032314-the-other-side-of-the-island,The Other Side of the Island,Allegra Goodman,578,4651,3.69,280,2008,FALSE,"Young Adult, Science Fiction, Dystopia","Dorothy Canfield Fisher Children's Book Award Nominee (2010), Missouri Truman Readers Award Nominee (2011)",
https://www.goodreads.com//book/show/29806086-the-book-of-the-unnamed-midwife,The Book of the Unnamed Midwife,Meg Elison,1987,13927,4.14,291,2016,TRUE,"Science Fiction, Fiction, Science Fiction","Philip K. Dick Award (2015), James Tiptree Jr. Award Nominee for Longlist (2014)",
https://www.goodreads.com//book/show/8534899-forsaken,Forsaken,Jana Oliver,1499,18072,3.99,422,2011,TRUE,"Young Adult, Fantasy, Paranormal",,"Atlanta, Georgia"
https://www.goodreads.com//book/show/11366397-the-program,The Program,Suzanne Young,5713,44636,4.05,405,2013,TRUE,"Young Adult, Science Fiction, Dystopia",Missouri Gateway Readers Award Nominee (2016),Oregon
https://www.goodreads.com//book/show/12393909-revealing-eden,Revealing Eden,Victoria Foyt,369,918,2,307,2012,TRUE,"Young Adult, Science Fiction, Dystopia",Eric Hoffer Book Award,
https://www.goodreads.com//book/show/49390139-war,War,Laura Thalassa,2003,14569,4.17,502,2019,TRUE,"Romance, Fantasy, Fantasy",,
https://www.goodreads.com//book/show/1857440.John_Dies_at_the_End,John Dies at the End,David  Wong,6269,61237,3.9,362,2007,TRUE,"Horror, Fiction, Humor",,"Las Vegas, Nevada, Undisclosed, Illinois"
https://www.goodreads.com//book/show/11112619-fever,Fever,Lauren DeStefano,3352,44034,3.78,341,2012,TRUE,"Science Fiction, Dystopia, Young Adult",,
https://www.goodreads.com//book/show/161849.Chocky,Chocky,John Wyndham,618,8158,3.82,154,1970,FALSE,"Science Fiction, Fiction, Classics",,United Kingdom
https://www.goodreads.com//book/show/13603717-first-shift,First Shift: Legacy,Hugh Howey,843,17276,4.22,238,2012,TRUE,"Science Fiction, Fiction, Science Fiction",,
https://www.goodreads.com//book/show/11553.Boy_s_Life,Boy's Life,Robert R. McCammon,2959,26591,4.36,580,1992,FALSE,"Horror, Fiction, Fantasy","Bram Stoker Award for Best Novel (1991), World Fantasy Award for Best Novel (1992), Japan Adventure Fiction Association Prize 日本冒険小説協会大賞特別賞 for Best Translated Novel (1995)","Zephyr, Alabama, Alabama"
https://www.goodreads.com//book/show/23209924-the-water-knife,The Water Knife,Paolo Bacigalupi,2996,21722,3.84,371,2015,FALSE,"Science Fiction, Fiction, Science Fiction","John W. Campbell Memorial Award Nominee for Best Science Fiction Novel (2016), Goodreads Choice Award Nominee for Science Fiction (2015), Seiun Award 星雲賞 Nominee for Best Translated Novel (2016)","Phoenix, Arizona"
https://www.goodreads.com//book/show/104342.Grass,Grass,Sheri S. Tepper,668,11086,4.05,544,2002,TRUE,"Science Fiction, Fiction, Fantasy",Hugo Award Nominee for Best Novel (1990),
https://www.goodreads.com//book/show/18966806-morning-star,Morning Star,Pierce Brown,10653,125851,4.48,524,2016,TRUE,"Science Fiction, Fantasy, Fiction","ITW Thriller Award Nominee for Best Young Adult Novel (2017), Goodreads Choice Award for Science Fiction (2016), Reddit r/fantasy Stabby Award for Best Novel (2016)",
https://www.goodreads.com//book/show/9265453-embassytown,Embassytown,China Miéville,3129,27535,3.88,345,2011,FALSE,"Science Fiction, Fiction, Fantasy","Hugo Award Nominee for Best Novel (2012), Nebula Award Nominee for Best Novel (2011), Locus Award for Best Science Fiction Novel (2012), Arthur C. Clarke Award Nominee (2012), Kurd-Laßwitz-Preis Nominee for Bestes ausländisches Werk (Best Foreign Work) (2013), British Science Fiction Association Award Nominee for Best Novel (2011), Romantic Times Reviewers' Choice Award (RT Award) for Best Science Fiction Novel (2011), John W. Campbell Memorial Award Nominee for Best Science Fiction Novel (2012), Grand Prix de l'Imaginaire Nominee for Roman étranger and Traduction (2016), Premio Ignotus for Mejor novela extranjera (Best Foreign Novel) (2014), The Kitschies Nominee for Red Tentacle (Novel) (2011), Goodreads Choice Award Nominee for Science Fiction (2011), Seiun Award 星雲賞 Nominee for Best Translated Long Form (2014)",
https://www.goodreads.com//book/show/35870.Ghost_in_the_Shell,Ghost in the Shell,Masamune Shirow,511,10602,4.17,350,2006,TRUE,"Sequential Art, Manga, Sequential Art",,
https://www.goodreads.com//book/show/6449916-girl-in-the-arena,Girl in the Arena,Lise Haines,868,5078,2.99,336,2009,FALSE,"Young Adult, Science Fiction, Dystopia",,
https://www.goodreads.com//book/show/767326.The_Fall,The Fall,Garth Nix,265,8845,3.81,195,2000,TRUE,"Fantasy, Young Adult, Fiction",,
https://www.goodreads.com//book/show/10174795-glow,Glow,Amy Kathleen Ryan,2023,13075,3.52,307,2011,TRUE,"Young Adult, Science Fiction, Science Fiction",,
