URL,Title,Author,Number of reviews,Number of ratings,Average rating,Pages,Publish year,Series,Genres,Awards,Places
https://www.goodreads.com//book/show/18077752-acceptance,Acceptance,Jeff VanderMeer,4757,46890,3.6,341,2014,TRUE,"Science Fiction, Fiction, Horror",,
https://www.goodreads.com//book/show/16160701-fire-country,Fire Country,David Estes,386,2074,4.06,398,2013,TRUE,"Science Fiction, Dystopia, Young Adult",,
https://www.goodreads.com//book/show/17920175-wayward,Wayward,Blake Crouch,2996,53731,4.13,298,2013,TRUE,"Science Fiction, Thriller, Fiction",,
https://www.goodreads.com//book/show/337116.The_Difference_Engine,The Difference Engine,William Gibson,1104,19945,3.45,429,1992,FALSE,"Science Fiction, Steampunk, Science Fiction","Nebula Award Nominee for Best Novel (1991), British Science Fiction Association Award Nominee for Best Novel (1990), John W. Campbell Memorial Award Nominee for Best Science Fiction Novel (1992)","London Bridge, London, England, London, England"
https://www.goodreads.com//book/show/33841.Against_the_Fall_of_Night,Against the Fall of Night,Arthur C. Clarke,158,4043,3.99,208,2003,FALSE,"Science Fiction, Fiction, Science Fiction Fantasy",,
https://www.goodreads.com//book/show/16200.Ella_Minnow_Pea,Ella Minnow Pea: A Novel in Letters,Mark Dunn,5583,30849,3.88,208,2002,FALSE,"Fiction, Humor, Fantasy",Borders Original Voices Award for Fiction (2001),
https://www.goodreads.com//book/show/834670.Glory_Season,Glory Season,David Brin,132,3282,3.74,772,1994,FALSE,"Science Fiction, Fiction, Fantasy","Hugo Award Nominee for Best Novel (1994), Locus Award Nominee for Best Science Fiction Novel (1993), James Tiptree Jr. Award Nominee for Longlist (1993)",
https://www.goodreads.com//book/show/17165934-game-slaves,Game Slaves,Gard Skinner,73,253,3.65,336,2014,FALSE,"Science Fiction, Young Adult, Fiction",,
https://www.goodreads.com//book/show/64701.The_Family_Tree,The Family Tree,Sheri S. Tepper,203,2890,4.01,496,1998,FALSE,"Fantasy, Science Fiction, Fiction",,
https://www.goodreads.com//book/show/2744237-daughters-of-the-north,Daughters of the North,Sarah Hall,511,3641,3.4,210,2008,FALSE,"Fiction, Science Fiction, Dystopia","Arthur C. Clarke Award Nominee (2008), John Llewellyn Rhys Prize (2007), Gaylactic Spectrum Award Nominee for Best Novel (2008), James Tiptree Jr. Award (2007)",
https://www.goodreads.com//book/show/13631837-whispers-in-autumn,Whispers in Autumn,Trisha Leigh,368,2410,3.87,418,2012,TRUE,"Young Adult, Science Fiction, Dystopia",,
https://www.goodreads.com//book/show/13013051-tortured,Tortured,Caragh M. O'Brien,332,4683,3.83,32,2011,TRUE,"Young Adult, Science Fiction, Dystopia",,
https://www.goodreads.com//book/show/13451182-arena-one,Arena One: Slaverunners,Morgan Rice,695,5854,3.37,300,2012,TRUE,"Science Fiction, Dystopia, Young Adult",,
https://www.goodreads.com//book/show/7956.Treason,Treason,Orson Scott Card,420,7035,3.91,288,2006,FALSE,"Science Fiction, Fiction, Fantasy",,
https://www.goodreads.com//book/show/28481.Dragon_Wing,Dragon Wing,Margaret Weis,625,26078,3.96,430,1990,TRUE,"Fantasy, Fiction, Fantasy",,
https://www.goodreads.com//book/show/37796866-vox,Vox,Christina Dalcher,9002,55335,3.55,336,2018,FALSE,"Fiction, Science Fiction, Dystopia",Goodreads Choice Award Nominee for Science Fiction (2018),"Georgetown, Washington, D.C."
https://www.goodreads.com//book/show/186437.Yarrow,Yarrow,Charles de Lint,86,2484,3.91,256,1997,TRUE,"Fantasy, Fantasy, Urban Fantasy",,"Ottawa, Ontario"
https://www.goodreads.com//book/show/17165913-the-shade-of-the-moon,The Shade of the Moon,Susan Beth Pfeffer,1229,9354,3.29,288,2013,TRUE,"Young Adult, Science Fiction, Dystopia",,
https://www.goodreads.com//book/show/100933.That_Hideous_Strength,That Hideous Strength,C.S. Lewis,1907,31459,3.89,534,2005,TRUE,"Science Fiction, Fiction, Fantasy","Prometheus Hall of Fame Award Nominee for (2003) (2008), Retro Hugo Award Nominee for Best Novel (1996)",England
https://www.goodreads.com//book/show/457015.Lullaby,Lullaby,Chuck Palahniuk,3052,93210,3.73,260,2003,FALSE,"Fiction, Horror, Contemporary",Bram Stoker Award Nominee for Best Novel (2002),
https://www.goodreads.com//book/show/76620.Watership_Down,Watership Down,Richard  Adams,14015,440939,4.06,478,1975,TRUE,"Classics, Fiction, Fantasy","Mythopoeic Fantasy Award Nominee (1975), Guardian Children's Fiction Prize (1973), Audie Award Nominee for Best Male Narrator (2020), Boston Globe-Horn Book Award (1975), California Young Readers Medal for Young Adult (1977), Carnegie Medal (1972)","Watership Down, Hampshire"
https://www.goodreads.com//book/show/1129928.Random_Acts_of_Senseless_Violence,Random Acts of Senseless Violence,Jack Womack,323,2300,3.95,256,1995,TRUE,"Science Fiction, Fiction, Science Fiction",,
https://www.goodreads.com//book/show/10075553-soft-apocalypse,Soft Apocalypse,Will McIntosh,451,2445,3.49,256,2011,FALSE,"Science Fiction, Apocalyptic, Post Apocalyptic",,"Georgia, Savannah, Georgia"
https://www.goodreads.com//book/show/18079719-grasshopper-jungle,Grasshopper Jungle,Andrew  Smith,3307,16889,3.63,388,2014,TRUE,"Young Adult, Science Fiction, LGBT","Michael L. Printz Award Nominee (2015), Milwaukee County Teen Book Award Nominee (2015), Boston Globe-Horn Book Award for Fiction (2014), The Inky Awards Nominee for Silver Inky (2015), The Kitschies for Red Tentacle (Novel) (2014), Premio El Templo de las Mil Puertas for Mejor novela extranjera independiente (2014)","Ealing, Iowa"
https://www.goodreads.com//book/show/13931.Foxmask,Foxmask,Juliet Marillier,189,4872,4.11,560,2005,TRUE,"Fantasy, Historical, Historical Fiction",,
https://www.goodreads.com//book/show/13.The_Ultimate_Hitchhiker_s_Guide_to_the_Galaxy,The Ultimate Hitchhiker's Guide to the Galaxy,Douglas Adams,5394,292145,4.36,815,2002,TRUE,"Science Fiction, Fiction, Humor",,
https://www.goodreads.com//book/show/636108.Dr_Bloodmoney,Dr. Bloodmoney,Philip K. Dick,480,7466,3.68,298,2002,FALSE,"Science Fiction, Fiction, Apocalyptic","Nebula Award Nominee for Best Novel (1965), Tähtivaeltaja Award Nominee (2011)","Point Reyes Station, California"
https://www.goodreads.com//book/show/17333324-ancillary-justice,Ancillary Justice,Ann Leckie,8654,84803,3.97,416,2013,TRUE,"Science Fiction, Fiction, Space","Hugo Award for Best Novel (2014), Nebula Award for Best Novel (2013), Locus Award for Best First Novel (2014), Arthur C. Clarke Award (2014), British Science Fiction Association Award for Best Novel (2013), Philip K. Dick Award Nominee (2014), John W. Campbell Memorial Award Nominee (2014), Compton Crook Award Nominee (2014), Grand Prix de l'Imaginaire for Traduction and Nominee for Roman étranger (2017), James Tiptree Jr. Award Nominee (2013), Premio Ignotus Nominee for Mejor novela extranjera (2016), British Fantasy Award for Best Newcomer (Sydney J. Bounds Award) (2014), The Kitschies for Golden Tentacle (Debut) (2013), Goodreads Choice Award Nominee for Science Fiction (2013), Seiun Award 星雲賞 for Best Foreign Novel (2016)",
https://www.goodreads.com//book/show/371316.The_Memoirs_of_a_Survivor,The Memoirs of a Survivor,Doris Lessing,245,2789,3.6,192,1995,FALSE,"Fiction, Science Fiction, Science Fiction",,
https://www.goodreads.com//book/show/15713052-the-fall,The Fall,David L.  Dawson,37,299,3.41,314,2012,TRUE,"Fantasy, Young Adult, Science Fiction",,
https://www.goodreads.com//book/show/5886881-dark-places,Dark Places,Gillian Flynn,36071,595317,3.93,349,2009,FALSE,"Mystery, Fiction, Thriller","Black Quill Award for Dark Genre Novel of the Year (2010), CWA Ian Fleming Steel Dagger Nominee (2010)","Kinnakee, Kansas, Kansas City, Missouri"
https://www.goodreads.com//book/show/41070.The_Shockwave_Rider,The Shockwave Rider,John Brunner,208,3671,3.95,288,1995,FALSE,"Science Fiction, Fiction, Science Fiction","Locus Award Nominee for Best Novel (1976), Ditmar Award Nominee for Best International Long Fiction (1976)",
https://www.goodreads.com//book/show/13170596-fragments,Fragments,Dan Wells,1878,24533,4.11,576,2013,TRUE,"Young Adult, Science Fiction, Dystopia",,
https://www.goodreads.com//book/show/28294.A_Void,A Void,Georges Perec,314,2779,3.79,284,2005,FALSE,"Fiction, Cultural, France",Scott Moncrieff Prize for Gilbert Adair (1995),Paris
https://www.goodreads.com//book/show/17607716-ruins,Ruins,Dan Wells,1425,15265,4.05,464,2014,TRUE,"Young Adult, Science Fiction, Dystopia",,
https://www.goodreads.com//book/show/1349956.The_Velveteen_Rabbit,The Velveteen Rabbit,Margery Williams Bianco,3644,227334,4.28,48,1995,FALSE,"Classics, Childrens, Fiction",Lewis Carroll Shelf Award (1971),
https://www.goodreads.com//book/show/10084.River_of_Blue_Fire,River of Blue Fire,Tad Williams,284,14864,4.02,675,1999,TRUE,"Fantasy, Science Fiction, Fiction",,
https://www.goodreads.com//book/show/116256.Patternmaster,Patternmaster,Octavia E. Butler,426,5904,4.01,202,1995,TRUE,"Science Fiction, Fiction, Fantasy",,
https://www.goodreads.com//book/show/16271.The_Intuitionist,The Intuitionist,Colson Whitehead,1220,10072,3.67,255,1999,FALSE,"Fiction, Science Fiction, Mystery",,United States of America
https://www.goodreads.com//book/show/9917879-the-unwanteds,The Unwanteds,Lisa McMann,3087,30087,4.11,390,2011,TRUE,"Fantasy, Childrens, Middle Grade","Pennsylvania Young Readers' Choice Award Nominee for Grades 6-8 (2014), California Young Readers Medal for Intermediate (2014), Goodreads Choice Award Nominee for Middle Grade & Children's (2011), Intermediate Nutmeg Book Award (2015)",
https://www.goodreads.com//book/show/30561.Ape_and_Essence,Ape and Essence,Aldous Huxley,315,4887,3.77,222,1992,FALSE,"Fiction, Science Fiction, Science Fiction",Prêmio Jabuti for Tradução (2018),"Los Angeles, California"
https://www.goodreads.com//book/show/6393972-this-world-we-live-in,This World We Live In,Susan Beth Pfeffer,2698,29550,3.8,256,2010,TRUE,"Young Adult, Science Fiction, Dystopia",,Pennsylvania
https://www.goodreads.com//book/show/10626594-the-scorpio-races,The Scorpio Races,Maggie Stiefvater,13072,102004,4.07,409,2011,FALSE,"Fantasy, Young Adult, Romance","Mythopoeic Fantasy Award Nominee for Children's Literature (2012), Odyssey Award Nominee (2012), Los Angeles Times Book Prize Nominee for Young Adult Literature (2011), Michael L. Printz Award Nominee (2012), Milwaukee County Teen Book Award Nominee (2013), The Inky Awards Nominee for Silver Inky (2012), Carnegie Medal Nominee (2013), Premio El Templo de las Mil Puertas for Mejor novela extranjera independiente (2013)",Thisby
https://www.goodreads.com//book/show/2325390.The_Wasteland_Prufrock_and_Other_Poems,"The Wasteland, Prufrock and Other Poems",T.S. Eliot,322,10294,4.18,88,2008,FALSE,"Poetry, Classics, Literature",,
https://www.goodreads.com//book/show/33160796-the-end-of-the-world-running-club,The End of the World Running Club,Adrian J. Walker,1299,11307,3.82,456,2017,TRUE,"Fiction, Science Fiction, Apocalyptic",,
https://www.goodreads.com//book/show/6325690-raiders-ransom,Raiders' Ransom,Emily Diamand,192,1167,3.63,334,2009,TRUE,"Fantasy, Science Fiction, Young Adult",,England
https://www.goodreads.com//book/show/990093.Ethan_of_Athos,Ethan of Athos,Lois McMaster Bujold,619,13559,3.79,237,1986,TRUE,"Science Fiction, Fiction, Space",,
https://www.goodreads.com//book/show/294460.Plague_Year,Plague Year,Jeff  Carlson,193,2559,3.41,304,2007,TRUE,"Science Fiction, Fiction, Apocalyptic",,
https://www.goodreads.com//book/show/11016305-stockholm,Stockholm,Kian Kaul,12,34,3.79,460,2011,FALSE,"Fiction, Contemporary",,
https://www.goodreads.com//book/show/10432883-germline,Germline,T.C. McCarthy,146,1059,3.53,384,2011,TRUE,"Science Fiction, War, Military Fiction",Compton Crook Award (2012),
https://www.goodreads.com//book/show/12843217-and-the-seas-shall-turn-to-lemonade,And the seas shall turn to lemonade,Sandra Nicholls,10,22,4.14,234,2012,FALSE,"Cultural, Canada, Humor",,
https://www.goodreads.com//book/show/16040250-the-fallen,The Fallen,Jack Ziebell,22,93,3.4,200,2012,FALSE,"Horror, Zombies, Science Fiction",,
https://www.goodreads.com//book/show/17856436-belligerent,Belligerent,B.N. Mauldin,22,127,4.23,226,2013,TRUE,"Science Fiction, Dystopia, Young Adult",,
https://www.goodreads.com//book/show/18187139-disappearance,Disappearance,Trevor James Zaple,9,17,3.29,291,2013,FALSE,"ERROR HERE!!!!!!!!!!, ERROR HERE!!!!!!!!!!, ERROR HERE!!!!!!!!!!",,"Toronto, Ontario"
https://www.goodreads.com//book/show/17897554-postapoc,Postapoc,Liz Worth,23,66,3.73,184,2013,FALSE,"Fiction, Science Fiction",,
https://www.goodreads.com//book/show/15818027-the-sity,The Sity,Curran Geist,15,40,3.68,384,2012,TRUE,Science Fiction,,
https://www.goodreads.com//book/show/20256771-tolomay-s-world-the-splitting-of-the-trunk,Tolomay's World The Splitting of The Trunk,M.E. Lorde,7,12,4.58,378,2013,TRUE,"ERROR HERE!!!!!!!!!!, ERROR HERE!!!!!!!!!!, ERROR HERE!!!!!!!!!!",,
https://www.goodreads.com//book/show/19482487-a-wicked-hunger,A Wicked Hunger,Kiersten Fay,185,683,3.7,not known,2014,TRUE,"Fantasy, Paranormal, Romance",,
https://www.goodreads.com//book/show/21483545-last-light-falling,Last Light Falling,J.E. Plemons,65,100,3.88,336,2014,TRUE,"Fantasy, Science Fiction, Dystopia",,
https://www.goodreads.com//book/show/22845686-the-genetic-lottery,The Genetic Lottery,Allison Goh,11,52,3.69,92,2014,TRUE,"Science Fiction, Science Fiction, Dystopia",,
https://www.goodreads.com//book/show/25971716-the-treemakers,The Treemakers,Christina L. Rozelle,189,528,4.24,374,2015,TRUE,"Science Fiction, Dystopia, Science Fiction",,
https://www.goodreads.com//book/show/25979296-caligatha,Caligatha,Matt Spire,11,88,4.11,369,2015,FALSE,"Science Fiction, Science Fiction, Dystopia",,
https://www.goodreads.com//book/show/25983204-the-scientist,The Scientist (Omnibus),Ryan Michael,17,39,3.62,219,2015,FALSE,Science Fiction,,
https://www.goodreads.com//book/show/34227144-the-crimson-throne,The Crimson Throne,Christi Stallard,18,42,4.05,322,2017,FALSE,"Fantasy, Fantasy, Paranormal",,
https://www.goodreads.com//book/show/35831195-magium,Magium: The Mage Tournament (Book 1),Chris Michael Wilson,23,271,3.92,377,2017,FALSE,"Fantasy, Adventure, Gamebooks",,
https://www.goodreads.com//book/show/39674665-mars-base-1,Mars Base 1: A new discovery!,Bruce   Walker,6,7,4.71,not known,2018,FALSE,"ERROR HERE!!!!!!!!!!, ERROR HERE!!!!!!!!!!, ERROR HERE!!!!!!!!!!",,
https://www.goodreads.com//book/show/43025686-behold-the-wanderer,Behold the Wanderer: A Novel against Modernity,Mathijs Koenraadt,1,7,3.86,193,2018,FALSE,"Fiction, Urban, Religion",,
https://www.goodreads.com//book/show/41726040-callasandra,Callasandra: Fractured,Stephanie Douglas,4,13,4.38,362,2018,FALSE,"ERROR HERE!!!!!!!!!!, ERROR HERE!!!!!!!!!!, ERROR HERE!!!!!!!!!!",,
https://www.goodreads.com//book/show/49014733-letters-from-the-light,Letters from the Light,Shel Calopa,48,63,4.27,469,2019,FALSE,"Science Fiction, Science Fiction, Dystopia",,
https://www.goodreads.com//book/show/52226194-agnes-at-the-end-of-the-world,Agnes at the End of the World,Kelly McWilliams,406,1392,3.8,432,2020,FALSE,"Young Adult, Science Fiction, Dystopia",,
https://www.goodreads.com//book/show/55375798-space-taxis,Space Taxis,Adam Frosh,37,54,4.61,340,2020,FALSE,"ERROR HERE!!!!!!!!!!, ERROR HERE!!!!!!!!!!, ERROR HERE!!!!!!!!!!",,
https://www.goodreads.com//book/show/7201564-this-dream-called-death,This Dream Called Death,Stephen Janis,5,15,4.33,164,2009,FALSE,"ERROR HERE!!!!!!!!!!, ERROR HERE!!!!!!!!!!, ERROR HERE!!!!!!!!!!",,
https://www.goodreads.com//book/show/11021753-the-dark-age,The Dark Age,Jeff W. Horton,13,57,4.02,333,2011,TRUE,"Science Fiction, Dystopia, Christian Fiction",,
https://www.goodreads.com//book/show/12502043-unveiled,Unveiled,Trisha Wolfe,80,293,3.81,56,2012,TRUE,"Fantasy, Young Adult, Science Fiction",,
https://www.goodreads.com//book/show/18213083-origins,Origins,S.E. Meyer,15,133,3.71,306,2013,TRUE,"Science Fiction, Fantasy, Business",,
https://www.goodreads.com//book/show/18583321-after-the-fall---tales-of-the-apocalypse,After the Fall - Tales of the Apocalypse,Kelly Gardner,13,131,3.61,206,2013,FALSE,"Apocalyptic, Post Apocalyptic, Short Stories",,
https://www.goodreads.com//book/show/19468216-plague-of-angels,Plague of Angels,John Patrick Kennedy,166,1028,3.49,416,2013,TRUE,"Fantasy, Paranormal, Angels",,
https://www.goodreads.com//book/show/16055238-khe,Khe,Alexes Razevich,74,501,3.74,284,2012,TRUE,"Fantasy, Science Fiction, Fiction",,
https://www.goodreads.com//book/show/18661769-above-all-men,Above All Men,Eric Shonkwiler,46,193,4.04,266,2014,FALSE,"Fiction, Science Fiction, Dystopia",,
https://www.goodreads.com//book/show/586852.The_Wall,The Wall,Marlen Haushofer,783,7288,4.03,240,1999,FALSE,"Fiction, Science Fiction, European Literature",,"The Alps, Europe, Austria"
https://www.goodreads.com//book/show/25131174-the-immortal-coil,The Immortal Coil,J. Armand,13,226,3.46,392,2015,TRUE,"Fantasy, Paranormal, Vampires",,
https://www.goodreads.com//book/show/30116307-beat,Beat,Jared Garrett,32,97,3.91,296,2015,TRUE,"Science Fiction, Science Fiction, Dystopia",,
https://www.goodreads.com//book/show/12343299-empty-cradle,Empty Cradle: The Untimely Death of Corey Sanderson,Emmy Jackson,14,46,4.72,378,2011,FALSE,"Science Fiction, Dystopia, Science Fiction",,
https://www.goodreads.com//book/show/7510368-the-cadaver-factory,The Cadaver Factory,Kenneth Jarrett Singleton,2,237,4.35,52,2004,FALSE,"Fiction, Horror, Contemporary",,
https://www.goodreads.com//book/show/43866656-we-lost-the-sky,"We Lost the Sky (Moonless, #1)",Marie Howalt,21,41,4.37,295,2019,FALSE,Science Fiction,,
https://www.goodreads.com//book/show/43517657-the-circle,The Circle: Taken,Sage Sask,72,115,4.11,442,2019,FALSE,"Young Adult, Science Fiction, Dystopia",,
https://www.goodreads.com//book/show/3418598-kinderen-van-moeder-aarde,Kinderen van Moeder Aarde,Thea Beckman,90,3481,4.22,347,2003,TRUE,"Fantasy, Young Adult, Childrens",,
https://www.goodreads.com//book/show/22591375-the-dead-lands,The Dead Lands,Dylan J. Morgan,26,43,4.19,470,2014,FALSE,"Horror, Science Fiction, Apocalyptic",,
https://www.goodreads.com//book/show/30625170-dark-age,Dark Age,Felix O. Hartmann,19,98,3.82,344,2016,FALSE,"Science Fiction, Fantasy, Fiction",,
https://www.goodreads.com//book/show/38726615-ana-rocha,Ana Rocha: Shadows of Justice,Ammar Habib,626,5146,4.23,218,2018,FALSE,"Thriller, Mystery, Crime",,"Houston, Texas"
https://www.goodreads.com//book/show/2111628.Ark,Ark,Stephen Baxter,298,3523,3.85,457,2009,TRUE,"Science Fiction, Fiction, Apocalyptic",,
https://www.goodreads.com//book/show/22466244-the-social-event,The Social Event,Don Lively,2,15,3.93,350,2014,FALSE,"ERROR HERE!!!!!!!!!!, ERROR HERE!!!!!!!!!!, ERROR HERE!!!!!!!!!!",,"San Jose, California, Mojave Desert, Tehachapi, California, Doha"
https://www.goodreads.com//book/show/23511050-the-whale-kingdom-quest,The Whale Kingdom Quest,Ming Wei,20,20,3.85,234,2014,FALSE,"ERROR HERE!!!!!!!!!!, ERROR HERE!!!!!!!!!!, ERROR HERE!!!!!!!!!!",,
https://www.goodreads.com//book/show/19395125-the-vanishing-girl,The Vanishing Girl,Laura Thalassa,475,5025,3.89,338,2014,TRUE,"New Adult, Romance, Fantasy",,
https://www.goodreads.com//book/show/13112869-not-a-drop-to-drink,Not a Drop to Drink,Mindy McGinnis,2140,12348,3.82,309,2013,TRUE,"Young Adult, Science Fiction, Dystopia",,
https://www.goodreads.com//book/show/18080920-the-transfer,The Transfer,Veronica Roth,3022,52215,4.18,55,2013,TRUE,"Young Adult, Science Fiction, Dystopia",,"Chicago, Illinois"
https://www.goodreads.com//book/show/155291.Agents_of_Light_and_Darkness,Agents of Light and Darkness,Simon R. Green,459,14854,4,233,2003,TRUE,"Fantasy, Urban Fantasy, Fantasy",,
https://www.goodreads.com//book/show/11021735-the-last-prophet,The Last Prophet,Jeff W. Horton,12,106,4.01,300,2011,FALSE,"Christian, Fiction, Christian Fiction",,
https://www.goodreads.com//book/show/22456265-their-border-lands-freedom,Their Border Lands Freedom,Marla Monroe,3,101,4.21,174,2014,TRUE,"Erotica, Menage, Adult Fiction",,
https://www.goodreads.com//book/show/6101718-the-magicians,The Magicians,Lev Grossman,22463,238848,3.52,402,2009,TRUE,"Fantasy, Fiction, Fantasy","ALA Alex Award (2010), The Kitschies Nominee for Red Tentacle (Novel) (2009), Goodreads Choice Award Nominee for Fiction & Fantasy (2009)","New York State, Brakebills College for Magical Pedagogy"
https://www.goodreads.com//book/show/12372058-rex-rising,Rex Rising,Chrystalla Thoma,81,805,3.59,227,2011,TRUE,"Science Fiction, Young Adult, Fantasy",,
https://www.goodreads.com//book/show/10673576-the-postmortal,The Postmortal,Drew Magary,1335,10847,3.79,369,2011,FALSE,"Fiction, Science Fiction, Science Fiction","Arthur C. Clarke Award Nominee (2012), Philip K. Dick Award Nominee (2012)",
https://www.goodreads.com//book/show/15733233-i-hope-you-find-me,I Hope You Find Me,Trish Marie Dawson,163,1307,3.82,243,2012,TRUE,"Apocalyptic, Post Apocalyptic, Science Fiction",Kindle Book Award Nominee for Suspense/Horror (Finalist) (2013),
https://www.goodreads.com//book/show/40698027-a-boy-and-his-dog-at-the-end-of-the-world,A Boy and His Dog at the End of the World,C.A. Fletcher,1575,8499,4.16,365,2019,FALSE,"Fiction, Science Fiction, Science Fiction",ALA Alex Award (2020),"Mingulay, Western Isles, Scotland"
https://www.goodreads.com//book/show/9302283-phantom-universe,Phantom Universe,Laura Kreitzer,79,457,3.78,228,2011,TRUE,"Science Fiction, Time Travel, Young Adult",,
https://www.goodreads.com//book/show/44175.Rash,Rash,Pete Hautman,535,3346,3.75,256,2006,FALSE,"Young Adult, Science Fiction, Science Fiction","Golden Duck Award for Young Adult (Hal Clement Award) (2007), Michigan Library Association Thumbs Up! Award (2007), Missouri Truman Readers Award Nominee (2009), Society of Midland Authors Award Nominee for Children's Fiction (2007)",Canada
https://www.goodreads.com//book/show/17733063-heresy,Heresy,Bryan  Murphy,2,8,3.63,21,2013,FALSE,"ERROR HERE!!!!!!!!!!, ERROR HERE!!!!!!!!!!, ERROR HERE!!!!!!!!!!",,
https://www.goodreads.com//book/show/18109771-the-fire-sermon,The Fire Sermon,Francesca Haig,1160,6560,3.61,384,2015,TRUE,"Fantasy, Young Adult, Science Fiction","Aurealis Award Nominee for Best Young Adult Novel (2015), David Gemmell Morningstar Award Nominee (2016), Norma K. Hemming Award Nominee (2016)",
https://www.goodreads.com//book/show/12754689-rapture,Rapture,Phillip W. Simpson,111,347,3.86,300,2011,TRUE,"Young Adult, Science Fiction, Dystopia",Sir Julius Vogel Award Nominee for Best Youth Novel (2012),
https://www.goodreads.com//book/show/18069760-linehan-saves,Linehan Saves,Bryan  Murphy,2,8,4.75,not known,2013,FALSE,"ERROR HERE!!!!!!!!!!, ERROR HERE!!!!!!!!!!, ERROR HERE!!!!!!!!!!",,
https://www.goodreads.com//book/show/1206358.Fearless,Fearless,Tim Lott,197,1233,3.84,267,2007,FALSE,"Young Adult, Science Fiction, Dystopia",Carnegie Medal Nominee (2008),
https://www.goodreads.com//book/show/337109.Paris_in_the_Twentieth_Century,Paris in the Twentieth Century,Jules Verne,232,2085,3.39,222,1997,FALSE,"Science Fiction, Classics, Fiction",,
https://www.goodreads.com//book/show/689855.Brother_in_the_Land,Brother in the Land,Robert Swindells,96,1128,3.95,151,2000,FALSE,"Young Adult, Apocalyptic, Post Apocalyptic","The Other Award (1984), Red House Children's Book Award (1985), Carnegie Medal Nominee (1984)",
https://www.goodreads.com//book/show/2643113-a-boy-and-his-dog-repent-harlequin-said-the-ticktockman,"A Boy and His Dog & ""Repent, Harlequin!"" said the Ticktockman",Harlan Ellison,25,593,4.12,not known,1987,FALSE,"Science Fiction, Fiction, Apocalyptic",,
https://www.goodreads.com//book/show/18341373-shadow-of-the-last-men,Shadow of the Last Men,J.M. Salyards,13,26,4.31,456,2013,TRUE,"Science Fiction, Dystopia, Science Fiction",,
https://www.goodreads.com//book/show/50776.The_Blithedale_Romance,The Blithedale Romance,Nathaniel Hawthorne,395,5148,3.36,204,2005,FALSE,"Classics, Fiction, Literature",,
https://www.goodreads.com//book/show/7719245-paranormalcy,Paranormalcy,Kiersten White,6146,95200,3.88,335,2010,TRUE,"Young Adult, Fantasy, Paranormal","Utah Book Award for Young Adult (2010), Whitney Award for Best Novel by a New Author (2010), Lincoln Award Nominee (2013)",
https://www.goodreads.com//book/show/27414369-flashfall,Flashfall,Jenny Moyer,261,1100,3.76,342,2016,TRUE,"Young Adult, Science Fiction, Science Fiction",,
https://www.goodreads.com//book/show/17855756-dust,Dust,Hugh Howey,4235,69307,4.25,458,2013,TRUE,"Science Fiction, Fiction, Science Fiction",Goodreads Choice Award Nominee for Science Fiction (2013),
https://www.goodreads.com//book/show/14759944-corpalism,Corpalism,Arun D. Ellis,105,297,3.36,778,2012,TRUE,"Science Fiction, Dystopia, Fiction",,
https://www.goodreads.com//book/show/195753.Some_Will_Not_Die,Some Will Not Die,Algis Budrys,15,229,3.46,224,2001,FALSE,"Science Fiction, Apocalyptic, Post Apocalyptic",,
https://www.goodreads.com//book/show/9825379-number-13,Number 13,M.G. Wells,82,185,4.15,196,2010,TRUE,"Fantasy, Adventure, Mystery",,
https://www.goodreads.com//book/show/15772644-night-of-the-purple-moon,Night of the Purple Moon,Scott Cramer,363,1944,3.73,186,2012,TRUE,"Young Adult, Science Fiction, Dystopia",,"Castine Island, Maine"
https://www.goodreads.com//book/show/22755233-embers,Embers,Karen Ann Hopkins,141,1193,3.87,357,2014,TRUE,"Fantasy, Young Adult, Fantasy",,
https://www.goodreads.com//book/show/25689074-stars-above,Stars Above,Marissa Meyer,8390,66817,4.19,369,2016,TRUE,"Young Adult, Fantasy, Science Fiction",,
https://www.goodreads.com//book/show/28362251-after-midnight,After Midnight,Santino Hassell,297,1523,3.89,not known,2011,FALSE,"Romance, M M Romance, Science Fiction",,
https://www.goodreads.com//book/show/43801769-highway-to-heartache,Highway to Heartache,David A. Simpson,53,288,4.57,351,2019,TRUE,"Horror, Horror, Zombies",,
https://www.goodreads.com//book/show/56571166-the-high-auction,"The High Auction (Wisdom Revolution, #1)",Misba,9,20,5,185,2021,FALSE,"Fantasy, Science Fiction Fantasy, Science Fiction",,
